{
  "schema_version": "1.0",
  "snapshot_id": "snapshot_verified_20261010",
  "as_of": "2026-10-10T11:57:23Z",
  "chain_id": 1,
  "block_number": 26161879,
  "prices_usd": {
    "USDe": {
      "value": "0.999597",
      "source_type": "observed"
    },
    "USDC": {
      "value": "0.9998671",
      "source_type": "observed"
    },
    "PYUSD": {
      "value": "1.000067",
      "source_type": "observed"
    },
    "sUSDe": {
      "value": "1.251839",
      "source_type": "derived"
    },
    "PT-sUSDe": {
      "value": "0.993391",
      "source_type": "derived"
    }
  },
  "exchange_rates": {
    "sUSDe_USDe": {
      "value": "1.252344",
      "source_type": "observed"
    }
  },
  "markets": {
    "aave_01": {
      "market_kind": "aave_v3_reserve",
      "liquidation_threshold": "0.93",
      "liquidation_bonus": "0.02",
      "oracle_pass_through": "0.0",
      "oracle_type": "aave_capped_usdt_usd",
      "oracle_address": "0xC26D4a1c46d884cfF6dE9800B6aE7A8Cf48B4Ff8",
      "emode_category": 11,
      "verified": true,
      "source_type": "observed",
      "field_sources": {
        "oracle_pass_through": "derived"
      },
      "warnings": [
        "Aave prices USDe with the Chainlink USDT/USD feed: a USDe market depeg does not move the oracle; a USDT depeg does."
      ]
    },
    "morpho_01": {
      "market_kind": "morpho_blue_market",
      "lltv": "0.915",
      "liquidation_incentive": "0.0262",
      "oracle_pass_through": "1.0",
      "oracle_type": "morpho_chainlink_v2_susde_vault_x_usde_usd_over_pyusd_usd",
      "oracle_address": "0xE6212D05cB5aF3C821Fef1C1A233a678724F9E7E",
      "verified": true,
      "source_type": "observed",
      "field_sources": {
        "liquidation_incentive": "derived",
        "oracle_pass_through": "derived"
      },
      "warnings": [
        "Incentive from Morpho Blue formula min(1.15, 1/(0.3 x LLTV + 0.7)) - 1."
      ]
    },
    "pendle_01": {
      "market_kind": "pendle_pt_market",
      "maturity": "2026-11-26T00:00:00Z",
      "days_to_maturity": "46.5018",
      "pt_implied_apy": "0.0501",
      "valuation_method": "implied_apy_discount",
      "market_address": "0x47ad2cd1dd15739a7a035b9d3b7828d916fef77e",
      "verified": true,
      "source_type": "observed",
      "field_sources": {
        "pt_implied_apy": "observed",
        "days_to_maturity": "derived"
      }
    }
  },
  "yields": {
    "ethena_susde_01": {
      "token_apy": "0.0485",
      "source_type": "observed",
      "field_sources": {
        "token_apy": "observed"
      }
    },
    "aave_01": {
      "collateral_supply_apy": "0.0024",
      "debt_borrow_apy": "0.0465",
      "source_type": "observed"
    },
    "morpho_01": {
      "collateral_supply_apy": "0.00",
      "debt_borrow_apy": "0.0418",
      "source_type": "observed"
    },
    "pendle_01": {
      "token_apy": "0.0501",
      "source_type": "observed"
    }
  },
  "exit_venues": {
    "venue:susde_usdc": {
      "asset": "sUSDe",
      "quote_method": "proxy",
      "effective_depth_usd": "200000000",
      "fee_rate": "0.001",
      "gas_usd": "40",
      "source_type": "assumed"
    },
    "venue:usde_usdc": {
      "asset": "USDe",
      "quote_method": "proxy",
      "effective_depth_usd": "300000000",
      "fee_rate": "0.001",
      "gas_usd": "40",
      "source_type": "assumed"
    },
    "venue:pendle_pt_susde": {
      "asset": "PT-sUSDe",
      "quote_method": "pool_reserves",
      "effective_depth_usd": "3820497",
      "observed_liquidity_usd": "3820497",
      "fee_rate": "0.001",
      "gas_usd": "40",
      "venue_address": "0x47ad2cd1dd15739a7a035b9d3b7828d916fef77e",
      "source_type": "observed",
      "field_sources": {
        "effective_depth_usd": "derived",
        "fee_rate": "assumed",
        "gas_usd": "assumed"
      }
    }
  },
  "warnings": [
    "Market parameters, oracles, prices and yields observed on Ethereum mainnet at the block above; holdings are fictional.",
    "sUSDe and USDe exit depths are still proxies (TO_VERIFY with aggregator quotes).",
    "Pendle depth = total observed pool liquidity under a constant-product proxy; the real AMM concentrates liquidity, so impact is overstated.",
    "The only Morpho sUSDe/USDC market holds ~9.5k USD; the position uses the liquid sUSDe/PYUSD market instead."
  ]
}
